Symptoms,Specialization,Doctor,Price
"High temperature, chills, sweating, headache",General Physician,Dr. Arjun Sharma,₹740
"Fever, cough, sore throat, runny nose",General Physician,Dr. Priya Verma,₹840
"Sore throat, runny nose, coughing, sneezing",General Physician,Dr. Amit Gupta,₹940
"Dull pain, pressure in the head, sensitivity to light",Neurologist,Dr. Suresh Rao,₹10660
"Abdominal pain, bloating, nausea, vomiting",Gastroenterologist,Dr. Nisha Patel,₹9840
"Sneezing, itchy eyes, runny nose, rash",Allergist,Dr. Rohan Mehta,₹9840
"Increased thirst, frequent urination, fatigue",Endocrinologist,Dr. Kavita Joshi,₹11480
"Headaches, shortness of breath, nosebleeds",Cardiologist,Dr. Vikram Singh,₹12300
"Wheezing, coughing, chest tightness, shortness of breath",Pulmonologist,Dr. Sneha Iyer,₹10660
"Joint pain, swelling, stiffness",Rheumatologist,Dr. Rahul Nair,₹9020
"Severe headache, nausea, sensitivity to light",Neurologist,Dr. Anjali Choudhary,₹10660
"Cough, fever, difficulty breathing",Pulmonologist,Dr. Sanjay Reddy,₹10660
"Cough, production of mucus, fatigue",Pulmonologist,Dr. Meera Bhattacharya,₹10660
"Chest pain, shortness of breath, fatigue",Cardiologist,Dr. Gaurav Kapoor,₹12300
"Severe pain in the side, blood in urine, nausea",Urologist,Dr. Ramesh Iyer,₹8500
"Fatigue, weakness, pale skin",Hematologist,Dr. Neelam Sethi,₹9000
"Heartburn, regurgitation, difficulty swallowing",Gastroenterologist,Dr. Amar Thakur,₹9840
"Fatigue, weight changes, sensitivity to temperature",Endocrinologist,Dr. Sheetal Deshmukh,₹11480
"Intense joint pain, swelling, redness",Rheumatologist,Dr. Vinay Patil,₹9020
"Redness, swelling, warmth, pus",Dermatologist,Dr. Pooja Jain,₹8000
"Nasal congestion, facial pain, headache",Otolaryngologist,Dr. Arvind Kumar,₹8500
"Persistent fatigue, sleep disturbances",Psychiatrist,Dr. Nitin Desai,₹10500
"Sadness, loss of interest, fatigue",Psychiatrist,Dr. Rhea Malhotra,₹10500
"Restlessness, rapid heartbeat, excessive worry",Psychologist,Dr. Tanuja Shetty,₹8000
"Chest pain, shortness of breath, fatigue",Cardiologist,Dr. Raghav Gupta,₹12300
"Bone fractures, back pain, loss of height",Endocrinologist,Dr. Suman Kaur,₹11480
"Abdominal pain, bloating, diarrhea, constipation",Gastroenterologist,Dr. Akash Menon,₹9840
"Abdominal pain, nausea, vomiting",Surgeon,Dr. Deepak Sinha,₹15000
"Bulge in the abdomen, pain, discomfort",Surgeon,Dr. Sonali Chawla,₹15000
"Jaundice, abdominal pain, swelling",Hepatologist,Dr. Kunal Shah,₹12000
"Sudden pain in the abdomen, nausea, vomiting",Gastroenterologist,Dr. Arti Verma,₹9840
"Diarrhea, bloating, fatigue",Dietitian,Dr. Preeti Joshi,₹5000
"Itchy skin, redness, dryness",Dermatologist,Dr. Rajesh Kumar,₹8000
"Red patches, dry skin, itching",Dermatologist,Dr. Priyanka Agarwal,₹8000
"Redness, swelling, itching",Dermatologist,Dr. Sanjay Bhatia,₹8000
"Nausea, vomiting, diarrhea",Infectious Disease Specialist,Dr. Aarti Gupta,₹10000
"Rapid heartbeat, sweating, trembling",Psychiatrist,Dr. Karan Mehta,₹10500
"Recurrent intrusive thoughts, anxiety",Psychologist,Dr. Anjali Dutta,₹8000
"Re-experiencing trauma, hyperarousal",Psychiatrist,Dr. Shalini Kapoor,₹10500
"Loud snoring, gasping for air, daytime fatigue",Gynecologist,Dr. Meera Malhotra,₹9500
"Irregular periods, hormonal imbalances",Gynecologist,Dr. Kavita Bhardwaj,₹9500
"Pelvic pain, fever, unusual discharge",Gynecologist,Dr. Neha Verma,₹9500
"Painful urination, frequent urge to urinate",Urologist,Dr. Rakesh Joshi,₹8500
"Hot flashes, mood swings, irregular periods",Gynecologist,Dr. Ritu Singh,₹9500
"Loss of libido, erectile dysfunction",Psychiatrist,Dr. Arvind Kumar,₹10500
"Irregular periods, hormonal imbalances",Pediatrician,Dr. Nikhil Bansal,₹9500
"Developmental delays, behavioral issues",Pediatrician,Dr. Sakshi Sharma,₹9500
"Memory loss, confusion, mood changes",Geriatrician,Dr. Ravi Desai,₹11000
"Cough, sore throat, difficulty breathing",Infectious Disease Specialist,Dr. Anand Iyer,₹10000
"Fever, cough, difficulty breathing, loss of taste and smell",Pediatrician,Dr. Vinod Agarwal,₹9500
"Itchy rash, fever, fatigue",Pediatrician,Dr. Jyoti Rani,₹9500
"High fever, cough, runny nose, red spots",Pediatrician,Dr. Prakash Verma,₹9000
"Swollen salivary glands, fever, headache",Pediatrician,Dr. Mohit Singh,₹9400
"Fever, sore throat, red rash",Pediatrician,Dr. Priti Joshi,₹9600
"Cough, weight loss, night sweats",Infectious Disease Specialist,Dr. Sanjeev Bansal,₹10000
"Flu-like symptoms, fever, fatigue",Infectious Disease Specialist,Dr. Rohan Gupta,₹11000
"Fatigue, jaundice, abdominal pain",Infectious Disease Specialist,Dr. Tarun Nair,₹12000
"Sore throat, difficulty swallowing, fever",Pediatrician,Dr. Aastha Bansal,₹9500
"Coughing, wheezing, difficulty breathing",Pediatrician,Dr. Ritika Kapoor,₹7500
"Pimples, blackheads, oily skin",Dermatologist,Dr. Vineet Sharma,₹8000
"Thinning hair, bald patches",Dermatologist,Dr. Arjun Soni,₹8000
"Itchy skin, redness, swelling",Infectious Disease Specialist,Dr. Rina Iyer,₹10000
"Fever, chills, fatigue",Infectious Disease Specialist,Dr. Saurabh Kumar,₹10000
"Fever, fatigue, body aches",Infectious Disease Specialist,Dr. Kavita Mehta,₹10000
"Abdominal pain, diarrhea",Pediatrician,Dr. Parul Gupta,₹9500
"Fatigue, weakness, brittle nails",Nutritionist,Dr. Shreya Nair,₹8000
"Weight gain, difficulty losing weight",Nutritionist,Dr. Nidhi Agarwal,₹8000
